{
  "$schema": "https://json-schema.org/draft/2020-12/schema",
  "title": "Workers Group Task Charter",
  "type": "object",
  "required": ["schema_version", "task_id", "title", "original_request", "objective", "scope", "non_goals", "constraints", "assumptions", "deliverables", "acceptance_criteria", "created_by", "status", "created_at", "updated_at"],
  "properties": {
    "schema_version": {"type": "string", "const": "1.0"},
    "task_id": {"type": "string", "minLength": 1},
    "title": {"type": "string", "minLength": 1},
    "original_request": {"type": "string", "minLength": 1},
    "objective": {"type": "string", "minLength": 1},
    "scope": {"type": "array", "items": {"type": "string"}},
    "non_goals": {"type": "array", "items": {"type": "string"}},
    "constraints": {"type": "array", "items": {"type": "string"}},
    "assumptions": {"type": "array", "items": {"type": "string"}},
    "deliverables": {"type": "array", "items": {"type": "string"}},
    "acceptance_criteria": {"type": "array", "items": {"type": "string"}},
    "created_by": {"type": "string", "const": "workers_boss"},
    "status": {"enum": ["CHARTERED", "PLANNING", "FEASIBILITY_REVIEW", "READY", "EXECUTING", "READY_FOR_QA", "QA_REVIEW", "READY_FOR_BOSS_REVIEW", "DONE", "BLOCKED", "NEEDS_REWORK", "QA_FAILED", "PARTIAL", "FAILED", "CANCELLED"]},
    "created_at": {"type": "string", "minLength": 1},
    "updated_at": {"type": "string", "minLength": 1}
  },
  "additionalProperties": false
}
